<?xml version="1.0" encoding="utf-8"?>
<TouristVoucher xmlns:xsi="http://www.w3.org/2001/XMLSchema-instance"
                xmlns="http://www.example.com/tourist"
                xsi:schemaLocation='http://www.example.com/tourist TouristVoucher.xsd'>
    <voucher>
        <id>v-1</id>
        <typeOfTour>pilgrimage</typeOfTour>
        <country>UAE</country>
        <dayAndNightQuantity>7/8</dayAndNightQuantity>
        <transport>plane</transport>
        <hotel>
            <stars>5</stars>
            <food></food>
            <room>2</room>
            <tv>true</tv>
            <airConditioning>true</airConditioning>
        </hotel>
        <cost>
            <price>1000</price>
            <currency>USD</currency>
        </cost>
    </voucher>
    <voucher>
        <id>v-2</id>
        <typeOfTour>rest</typeOfTour>
        <country>Spain</country>
        <dayAndNightQuantity>10/9</dayAndNightQuantity>
        <transport>railway</transport>
        <hotel>
            <stars>4</stars>
            <food>A1</food>
            <room>1</room>
            <tv>true</tv>
            <airConditioning>true</airConditioning>
        </hotel>
        <cost>
            <price>850</price>
            <currency>EUR</currency>
        </cost>
    </voucher>

</TouristVoucher>